Year,Category,Unit measure,Value
2020,,Percentage (%),68.75
2020,Institutionalization of Political Commitment,Percentage (%),100.0
2020,Long-term considerations in decision-making,Percentage (%),80.0
2020,Inter-ministerial and cross-sectoral coordination,Percentage (%),30.0
2020,Participatory processes,Percentage (%),80.0
2020,Policy linkages,Percentage (%),30.0
2020,Alignment across government levels,Percentage (%),100.0
2020,Monitoring and reporting for policy coherence,Percentage (%),80.0
2020,Financing for policy coherence,Percentage (%),50.0
